{
  "$schema": "https://json-schema.org/draft/2020-12/schema",
  "$id": "https://aos.dev/air/v2/defop.schema.json",
  "title": "AIR v2 defop",
  "type": "object",
  "properties": {
    "$kind": { "const": "defop" },
    "name": { "$ref": "common.schema.json#/$defs/Name" },
    "op_kind": {
      "type": "string",
      "enum": ["workflow", "effect"]
    },
    "workflow": { "$ref": "#/$defs/WorkflowOp" },
    "effect": { "$ref": "#/$defs/EffectOp" },
    "impl": { "$ref": "#/$defs/OpImpl" }
  },
  "required": ["$kind", "name", "op_kind", "impl"],
  "allOf": [
    {
      "if": {
        "properties": { "op_kind": { "const": "workflow" } },
        "required": ["op_kind"]
      },
      "then": {
        "required": ["workflow"],
        "not": { "required": ["effect"] }
      }
    },
    {
      "if": {
        "properties": { "op_kind": { "const": "effect" } },
        "required": ["op_kind"]
      },
      "then": {
        "required": ["effect"],
        "not": { "required": ["workflow"] }
      }
    }
  ],
  "additionalProperties": false,
  "$defs": {
    "WorkflowOp": {
      "type": "object",
      "properties": {
        "state": { "$ref": "common.schema.json#/$defs/SchemaRef" },
        "event": { "$ref": "common.schema.json#/$defs/SchemaRef" },
        "context": { "$ref": "common.schema.json#/$defs/SchemaRef" },
        "annotations": { "$ref": "common.schema.json#/$defs/SchemaRef" },
        "key_schema": { "$ref": "common.schema.json#/$defs/SchemaRef" },
        "effects_emitted": {
          "type": "array",
          "items": { "$ref": "common.schema.json#/$defs/Name" },
          "uniqueItems": true
        },
        "determinism": {
          "type": "string",
          "enum": ["strict", "checked", "decision_log"],
          "default": "strict"
        }
      },
      "required": ["state", "event", "effects_emitted"],
      "additionalProperties": false
    },
    "EffectOp": {
      "type": "object",
      "properties": {
        "params": { "$ref": "common.schema.json#/$defs/SchemaRef" },
        "receipt": { "$ref": "common.schema.json#/$defs/SchemaRef" }
      },
      "required": ["params", "receipt"],
      "additionalProperties": false
    },
    "OpImpl": {
      "type": "object",
      "properties": {
        "module": { "$ref": "common.schema.json#/$defs/Name" },
        "entrypoint": {
          "type": "string",
          "minLength": 1
        }
      },
      "required": ["module", "entrypoint"],
      "additionalProperties": false
    }
  }
}
